{
  "fixtureId": "slack-normal-01",
  "synthetic": true,
  "category": "NORMAL",
  "description": "모든 일감 필드가 있고 thread에서 잠금 정책을 명시적으로 확정한 정상 사례",
  "source": {
    "workspaceId": "T_SYNTHETIC",
    "channelId": "C_SYNTHETIC",
    "root": {
      "messageTs": "1787191200.000001",
      "messageRevisionId": "rev_n01_root",
      "authorId": "U_SYN_001",
      "body": "[일감]\n개발건: 비밀번호 재설정 개선\n요청 메뉴: 회원 > 계정관리 > 비밀번호\n기능 설명: 이메일 인증 후 비밀번호를 변경하는 기능\n요청내용: 인증번호 유효시간은 5분이며, 오류 횟수 제한을 적용한다.",
      "permalink": "https://synthetic.invalid/archives/C_SYNTHETIC/p1787191200000001",
      "revision": 1
    },
    "thread": [
      {
        "messageTs": "1787191260.000001",
        "messageRevisionId": "rev_n01_reply_01",
        "authorId": "U_SYN_002",
        "body": "오류 5회면 인증 입력을 잠그는 것으로 결정합니다.",
        "permalink": "https://synthetic.invalid/archives/C_SYNTHETIC/p1787191260000001",
        "revision": 1
      }
    ]
  },
  "expected": {
    "parseResult": {
      "developmentItem": "비밀번호 재설정 개선",
      "requestedMenu": "회원 > 계정관리 > 비밀번호",
      "featureDescription": "이메일 인증 후 비밀번호를 변경하는 기능",
      "requestDetails": "인증번호 유효시간은 5분이며, 오류 5회면 인증 입력을 잠근다.",
      "missingFields": [],
      "confidence": 0.98,
      "sourceMessageRevisions": ["rev_n01_root", "rev_n01_reply_01"]
    },
    "knowledgeItems": [
      {
        "knowledgeId": "knowledge_n01_expiry",
        "nodeType": "REQUIREMENT",
        "content": "인증번호 유효시간은 5분이다.",
        "status": "ACTIVE",
        "evidenceSourceMessageRevisions": ["rev_n01_root"],
        "supersedesKnowledgeIds": [],
        "reason": "일감 본문에 명시된 현재 요구사항이다."
      },
      {
        "knowledgeId": "knowledge_n01_lock",
        "nodeType": "DECISION",
        "content": "인증번호 오류 5회면 인증 입력을 잠근다.",
        "status": "ACTIVE",
        "evidenceSourceMessageRevisions": ["rev_n01_reply_01"],
        "supersedesKnowledgeIds": [],
        "reason": "thread에서 결정 표현으로 명시적으로 확정했다."
      }
    ],
    "generationContext": {
      "shouldGenerate": true,
      "activeKnowledgeIds": ["knowledge_n01_expiry", "knowledge_n01_lock"],
      "excludedKnowledgeIds": [],
      "openQuestions": []
    }
  }
}
