{
  "fixtureId": "slack-conflict-03",
  "synthetic": true,
  "category": "CONFLICT",
  "description": "환불 승인 권한을 고객지원과 관리자 역할로 각각 제한해 결론이 없는 사례",
  "source": {
    "workspaceId": "T_SYNTHETIC",
    "channelId": "C_SYNTHETIC",
    "root": {
      "messageTs": "1787234400.000012",
      "messageRevisionId": "rev_c03_root",
      "authorId": "U_SYN_024",
      "body": "[일감]\n개발건: 수동 환불 승인 기능\n요청 메뉴: 주문 > 취소·환불\n기능 설명: 내부 담당자가 수동 환불 요청을 승인한다.\n요청내용: 승인 가능한 역할을 제한한다.",
      "permalink": "https://synthetic.invalid/archives/C_SYNTHETIC/p1787234400000012",
      "revision": 1
    },
    "thread": [
      {
        "messageTs": "1787234460.000012",
        "messageRevisionId": "rev_c03_reply_01",
        "authorId": "U_SYN_025",
        "body": "고객지원 역할만 승인할 수 있어야 합니다.",
        "permalink": "https://synthetic.invalid/archives/C_SYNTHETIC/p1787234460000012",
        "revision": 1
      },
      {
        "messageTs": "1787234520.000012",
        "messageRevisionId": "rev_c03_reply_02",
        "authorId": "U_SYN_026",
        "body": "관리자 역할만 가능해야 하고 고객지원에는 주면 안 됩니다.",
        "permalink": "https://synthetic.invalid/archives/C_SYNTHETIC/p1787234520000012",
        "revision": 1
      }
    ]
  },
  "expected": {
    "parseResult": {
      "developmentItem": "수동 환불 승인 기능",
      "requestedMenu": "주문 > 취소·환불",
      "featureDescription": "내부 담당자가 수동 환불 요청을 승인한다.",
      "requestDetails": "승인 가능한 역할을 제한한다.",
      "missingFields": [],
      "confidence": 0.91,
      "sourceMessageRevisions": ["rev_c03_root"]
    },
    "knowledgeItems": [
      {
        "knowledgeId": "knowledge_c03_support",
        "nodeType": "CONSTRAINT",
        "content": "수동 환불은 고객지원 역할만 승인할 수 있다.",
        "status": "AMBIGUOUS",
        "evidenceSourceMessageRevisions": ["rev_c03_reply_01"],
        "supersedesKnowledgeIds": [],
        "reason": "관리자 전용 주장과 충돌하고 최종 결론이 없다."
      },
      {
        "knowledgeId": "knowledge_c03_admin",
        "nodeType": "CONSTRAINT",
        "content": "수동 환불은 관리자 역할만 승인할 수 있다.",
        "status": "AMBIGUOUS",
        "evidenceSourceMessageRevisions": ["rev_c03_reply_02"],
        "supersedesKnowledgeIds": [],
        "reason": "고객지원 전용 주장과 충돌하고 최종 결론이 없다."
      }
    ],
    "generationContext": {
      "shouldGenerate": false,
      "activeKnowledgeIds": [],
      "excludedKnowledgeIds": ["knowledge_c03_support", "knowledge_c03_admin"],
      "openQuestions": ["수동 환불 승인 권한을 고객지원과 관리자 중 어느 역할에 부여할지 확정되지 않았다."]
    }
  }
}
